{
  "name": "Queimadura",
  "pain": 1.875,
  "bleed": 0.0,
  "overkillMin": 40.0,
  "overkillMax": 100.0,
  "heal": 2.0,
  "instakill": false,
  "destruction": "Queimado",
  "creations": [
    {
      "interval": 21600,
      "injury": {
        "type": "infection",
        "severity": {
          "op": "mul",
          "numbers": [
            0.25,
            "$0"
          ]
        }
      },

      "condition": {
        "op": "rand",
        "probability": {
          "op": "mul",
          "numbers": [
            0.05,
            "$0"
          ]
        }
      }
    }
  ]
}