{
  "name": "Corte",
  "pain": 1.25,
  "bleed": 0.06,
  "overkillMin": 0.0,
  "overkillMax": 10.0,
  "heal": 1.0,
  "instakill": false,
  "destruction": "Cortado Fora",
  "creations": [
    {
      "interval": 21600,
      "injury": {
        "type": "infection",
        "severity": "= 0.5 * $0"
      },
      "condition": "= rand(0.1 * $0)"
    }
  ]
}